<?xml version = "1.0"?>

<xs:schema xmlns:xs="http://www.w3.org/2001/XMLSchema" targetNamespace="http://www.example.com/Club" xmlns="http://www.example.com/Club">
    <xs:element name="schema">
        <xs:complexType>
            <xs:sequence>
                <xs:element name="beers">
                    <xs:complexType>
                        <xs:sequence>
                            <xs:element name="beer" type="BeerType" minOccurs="1" maxOccurs="unbounded" />
                        </xs:sequence>
                    </xs:complexType>
                </xs:element>
            </xs:sequence>
        </xs:complexType>
    </xs:element>

    <xs:complexType name="IngridientsType">
        <xs:sequence>
            <xs:element name="ingridient" minOccurs="0" maxOccurs="200">
                <xs:complexType>
                    <xs:simpleContent>
                        <xs:extension base="xs:string">
                        </xs:extension>
                    </xs:simpleContent>
                </xs:complexType>
            </xs:element>
        </xs:sequence>
    </xs:complexType>

    <xs:complexType name="SpillMethodType">
        <xs:sequence>
            <xs:element name = "capacity" type = "xs:positiveInteger"/>
            <xs:element name = "material" type = "xs:string"/>
        </xs:sequence>
    </xs:complexType>

    <xs:complexType name="CharsType">
        <xs:sequence>
            <xs:element name = "revolNumber" type = "xs:positiveInteger" minOccurs="0" maxOccurs="1" />
            <xs:element name = "transparency" type = "xs:positiveInteger"/>
            <xs:element name = "filtered" type = "xs:boolean"/>
            <xs:element name = "nutritionalValue" type = "xs:positiveInteger"/>
            <xs:element name = "spillMethod" type = "SpillMethodType"/>
        </xs:sequence>
    </xs:complexType>

    <xs:complexType name = "BeerType">
        <xs:sequence>
            <xs:element name = "name" type = "xs:string"/>
            <xs:element name = "type">
            <xs:simpleType>
                <xs:restriction base="xs:normalizedString">
                    <xs:enumeration value="dark"/>
                    <xs:enumeration value="light"/>
                    <xs:enumeration value="alive"/>
                    <xs:enumeration value="camp"/>
                </xs:restriction>
            </xs:simpleType>
            </xs:element>
            <xs:element name = "al" type = "xs:boolean"/>
            <xs:element name = "manufacturer" type = "xs:string"/>
	        <xs:element name = "ingridients" type = "IngridientsType"/>
            <xs:element name = "chars" type = "CharsType"/>
        </xs:sequence>
    </xs:complexType>
</xs:schema>
