<?xml version="1.0" encoding="utf-8"?>
<tns:schema xmlns:tns="http://www.example.com/Club" xmlns:xsi="http://www.w3.org/2001/XMLSchema-instance" xsi:schemaLocation="http://www.example.com/shema schema.xsd ">
    <beers>
        <beer>
            <name>beer1</name>
            <type>light</type>
            <al>true</al>
            <manufacturer>m1</manufacturer>
	        <ingridients>
                <ingridient>i1</ingridient>
                <ingridient>i2</ingridient>
            </ingridients>
            <chars>
                <revolNumber>10</revolNumber>
                <transparency>50</transparency>
                <filtered>false</filtered>
                <nutritionalValue>115</nutritionalValue>
                <spillMethod>
                    <capacity>12</capacity>
                    <material>material1</material>
                </spillMethod>
            </chars>
        </beer>

	<beer>
            <name>beer2</name>
            <type>dark</type>
            <al>true</al>
            <manufacturer>m2</manufacturer>
            <ingridients>
                <ingridient>i1</ingridient>
                <ingridient>i2</ingridient>
            </ingridients>
            <chars>
                <revolNumber>30</revolNumber>
                <transparency>20</transparency>
                <filtered>false</filtered>
                <nutritionalValue>137</nutritionalValue>
                <spillMethod>
                    <capacity>15</capacity>
                    <material>material1</material>
                </spillMethod>
            </chars>
        </beer>0

	<beer>
            <name>beer3</name>
            <type>dark</type>
            <al>false</al>
            <manufacturer>m3</manufacturer>
            <ingridients>
                <ingridient>i1</ingridient>
                <ingridient>i2</ingridient>
            </ingridients>
            <chars>
                <transparency>50</transparency>
                <filtered>false</filtered>
                <nutritionalValue>300</nutritionalValue>
                <spillMethod>
                    <capacity>12</capacity>
                    <material>material1</material>
                </spillMethod>
            </chars>
        </beer>
    </beers>
</tns:schema>
